{
  "event_id": "2026-09-10",
  "title_en": "Dry monsoon-break day, 10 Sep 2026 (synthetic fixture)",
  "kind": "dry",
  "start": "2026-09-10T00:00:00Z",
  "end": "2026-09-10T17:00:00Z",
  "frame_count": 18,
  "frames": [
    {
      "run_id": "2026-09-10T00:00:00Z",
      "as_of": "2026-09-10T00:00:00Z",
      "mode": "replay",
      "params_version": "v1",
      "city": {
        "status": "STANDBY",
        "rain_trigger_max": 0.0,
        "spots_raining": 0
      },
      "hotspots": [
        {
          "hotspot_id": "DL-004",
          "rank": 1,
          "level": "LOW",
          "risk": 0.0,
          "rain_trigger": 0.0,
          "susceptibility": 1.0,
          "intensity_mm_h": 0.0,
          "rain_24h_mm": 0.0,
          "effective_intensity_mm_h": 0.0,
          "peak_at": null
        },
        {
          "hotspot_id": "DL-005",
          "rank": 2,
          "level": "LOW",
          "risk": 0.0,
          "rain_trigger": 0.0,
          "susceptibility": 0.947,
          "intensity_mm_h": 0.0,
          "rain_24h_mm": 0.0,
          "effective_intensity_mm_h": 0.0,
          "peak_at": null
        },
        {
          "hotspot_id": "DL-001",
          "rank": 3,
          "level": "LOW",
          "risk": 0.0,
          "rain_trigger": 0.0,
          "susceptibility": 0.815,
          "intensity_mm_h": 0.0,
          "rain_24h_mm": 0.0,
          "effective_intensity_mm_h": 0.0,
          "peak_at": null
        },
        {
          "hotspot_id": "DL-002",
          "rank": 4,
          "level": "LOW",
          "risk": 0.0,
          "rain_trigger": 0.0,
          "susceptibility": 0.775,
          "intensity_mm_h": 0.0,
          "rain_24h_mm": 0.0,
          "effective_intensity_mm_h": 0.0,
          "peak_at": null
        },
        {
          "hotspot_id": "DL-006",
          "rank": 5,
          "level": "LOW",
          "risk": 0.0,
          "rain_trigger": 0.0,
          "susceptibility": 0.698,
          "intensity_mm_h": 0.0,
          "rain_24h_mm": 0.0,
          "effective_intensity_mm_h": 0.0,
          "peak_at": null
        },
        {
          "hotspot_id": "DL-010",
          "rank": 6,
          "level": "LOW",
          "risk": 0.0,
          "rain_trigger": 0.0,
          "susceptibility": 0.676,
          "intensity_mm_h": 0.0,
          "rain_24h_mm": 0.0,
          "effective_intensity_mm_h": 0.0,
          "peak_at": null
        },
        {
          "hotspot_id": "DL-007",
          "rank": 7,
          "level": "LOW",
          "risk": 0.0,
          "rain_trigger": 0.0,
          "susceptibility": 0.64,
          "intensity_mm_h": 0.0,
          "rain_24h_mm": 0.0,
          "effective_intensity_mm_h": 0.0,
          "peak_at": null
        },
        {
          "hotspot_id": "DL-003",
          "rank": 8,
          "level": "LOW",
          "risk": 0.0,
          "rain_trigger": 0.0,
          "susceptibility": 0.629,
          "intensity_mm_h": 0.0,
          "rain_24h_mm": 0.0,
          "effective_intensity_mm_h": 0.0,
          "peak_at": null
        },
        {
          "hotspot_id": "DL-009",
          "rank": 9,
          "level": "LOW",
          "risk": 0.0,
          "rain_trigger": 0.0,
          "susceptibility": 0.522,
          "intensity_mm_h": 0.0,
          "rain_24h_mm": 0.0,
          "effective_intensity_mm_h": 0.0,
          "peak_at": null
        },
        {
          "hotspot_id": "DL-008",
          "rank": 10,
          "level": "LOW",
          "risk": 0.0,
          "rain_trigger": 0.0,
          "susceptibility": 0.36,
          "intensity_mm_h": 0.0,
          "rain_24h_mm": 0.0,
          "effective_intensity_mm_h": 0.0,
          "peak_at": null
        },
        {
          "hotspot_id": "DL-012",
          "rank": 11,
          "level": "LOW",
          "risk": 0.0,
          "rain_trigger": 0.0,
          "susceptibility": 0.355,
          "intensity_mm_h": 0.0,
          "rain_24h_mm": 0.0,
          "effective_intensity_mm_h": 0.0,
          "peak_at": null
        },
        {
          "hotspot_id": "DL-011",
          "rank": 12,
          "level": "LOW",
          "risk": 0.0,
          "rain_trigger": 0.0,
          "susceptibility": 0.191,
          "intensity_mm_h": 0.0,
          "rain_24h_mm": 0.0,
          "effective_intensity_mm_h": 0.0,
          "peak_at": null
        }
      ]
    },
    {
      "run_id": "2026-09-10T01:00:00Z",
      "as_of": "2026-09-10T01:00:00Z",
      "mode": "replay",
      "params_version": "v1",
      "city": {
        "status": "STANDBY",
        "rain_trigger_max": 0.0,
        "spots_raining": 0
      },
      "hotspots": [
        {
          "hotspot_id": "DL-004",
          "rank": 1,
          "level": "LOW",
          "risk": 0.0,
          "rain_trigger": 0.0,
          "susceptibility": 1.0,
          "intensity_mm_h": 0.0,
          "rain_24h_mm": 0.0,
          "effective_intensity_mm_h": 0.0,
          "peak_at": null
        },
        {
          "hotspot_id": "DL-005",
          "rank": 2,
          "level": "LOW",
          "risk": 0.0,
          "rain_trigger": 0.0,
          "susceptibility": 0.947,
          "intensity_mm_h": 0.0,
          "rain_24h_mm": 0.0,
          "effective_intensity_mm_h": 0.0,
          "peak_at": null
        },
        {
          "hotspot_id": "DL-001",
          "rank": 3,
          "level": "LOW",
          "risk": 0.0,
          "rain_trigger": 0.0,
          "susceptibility": 0.815,
          "intensity_mm_h": 0.0,
          "rain_24h_mm": 0.0,
          "effective_intensity_mm_h": 0.0,
          "peak_at": null
        },
        {
          "hotspot_id": "DL-002",
          "rank": 4,
          "level": "LOW",
          "risk": 0.0,
          "rain_trigger": 0.0,
          "susceptibility": 0.775,
          "intensity_mm_h": 0.0,
          "rain_24h_mm": 0.0,
          "effective_intensity_mm_h": 0.0,
          "peak_at": null
        },
        {
          "hotspot_id": "DL-006",
          "rank": 5,
          "level": "LOW",
          "risk": 0.0,
          "rain_trigger": 0.0,
          "susceptibility": 0.698,
          "intensity_mm_h": 0.0,
          "rain_24h_mm": 0.0,
          "effective_intensity_mm_h": 0.0,
          "peak_at": null
        },
        {
          "hotspot_id": "DL-010",
          "rank": 6,
          "level": "LOW",
          "risk": 0.0,
          "rain_trigger": 0.0,
          "susceptibility": 0.676,
          "intensity_mm_h": 0.0,
          "rain_24h_mm": 0.0,
          "effective_intensity_mm_h": 0.0,
          "peak_at": null
        },
        {
          "hotspot_id": "DL-007",
          "rank": 7,
          "level": "LOW",
          "risk": 0.0,
          "rain_trigger": 0.0,
          "susceptibility": 0.64,
          "intensity_mm_h": 0.0,
          "rain_24h_mm": 0.0,
          "effective_intensity_mm_h": 0.0,
          "peak_at": null
        },
        {
          "hotspot_id": "DL-003",
          "rank": 8,
          "level": "LOW",
          "risk": 0.0,
          "rain_trigger": 0.0,
          "susceptibility": 0.629,
          "intensity_mm_h": 0.0,
          "rain_24h_mm": 0.0,
          "effective_intensity_mm_h": 0.0,
          "peak_at": null
        },
        {
          "hotspot_id": "DL-009",
          "rank": 9,
          "level": "LOW",
          "risk": 0.0,
          "rain_trigger": 0.0,
          "susceptibility": 0.522,
          "intensity_mm_h": 0.0,
          "rain_24h_mm": 0.0,
          "effective_intensity_mm_h": 0.0,
          "peak_at": null
        },
        {
          "hotspot_id": "DL-008",
          "rank": 10,
          "level": "LOW",
          "risk": 0.0,
          "rain_trigger": 0.0,
          "susceptibility": 0.36,
          "intensity_mm_h": 0.0,
          "rain_24h_mm": 0.0,
          "effective_intensity_mm_h": 0.0,
          "peak_at": null
        },
        {
          "hotspot_id": "DL-012",
          "rank": 11,
          "level": "LOW",
          "risk": 0.0,
          "rain_trigger": 0.0,
          "susceptibility": 0.355,
          "intensity_mm_h": 0.0,
          "rain_24h_mm": 0.0,
          "effective_intensity_mm_h": 0.0,
          "peak_at": null
        },
        {
          "hotspot_id": "DL-011",
          "rank": 12,
          "level": "LOW",
          "risk": 0.0,
          "rain_trigger": 0.0,
          "susceptibility": 0.191,
          "intensity_mm_h": 0.0,
          "rain_24h_mm": 0.0,
          "effective_intensity_mm_h": 0.0,
          "peak_at": null
        }
      ]
    },
    {
      "run_id": "2026-09-10T02:00:00Z",
      "as_of": "2026-09-10T02:00:00Z",
      "mode": "replay",
      "params_version": "v1",
      "city": {
        "status": "STANDBY",
        "rain_trigger_max": 0.0,
        "spots_raining": 0
      },
      "hotspots": [
        {
          "hotspot_id": "DL-004",
          "rank": 1,
          "level": "LOW",
          "risk": 0.0,
          "rain_trigger": 0.0,
          "susceptibility": 1.0,
          "intensity_mm_h": 0.0,
          "rain_24h_mm": 0.0,
          "effective_intensity_mm_h": 0.0,
          "peak_at": null
        },
        {
          "hotspot_id": "DL-005",
          "rank": 2,
          "level": "LOW",
          "risk": 0.0,
          "rain_trigger": 0.0,
          "susceptibility": 0.947,
          "intensity_mm_h": 0.0,
          "rain_24h_mm": 0.0,
          "effective_intensity_mm_h": 0.0,
          "peak_at": null
        },
        {
          "hotspot_id": "DL-001",
          "rank": 3,
          "level": "LOW",
          "risk": 0.0,
          "rain_trigger": 0.0,
          "susceptibility": 0.815,
          "intensity_mm_h": 0.0,
          "rain_24h_mm": 0.0,
          "effective_intensity_mm_h": 0.0,
          "peak_at": null
        },
        {
          "hotspot_id": "DL-002",
          "rank": 4,
          "level": "LOW",
          "risk": 0.0,
          "rain_trigger": 0.0,
          "susceptibility": 0.775,
          "intensity_mm_h": 0.0,